ArticleId,Text,Category
1802,continental  may run out of cash  shares in continental airlines have tumbled after the firm warned it could run out of cash.  in a filing to us regulators the airline warned of  inadequate liquidity  if it fails to reduce wage costs by $500m by the end of february. continental also said that  if it did not make any cuts  it expects to lose  hundreds of millions of dollars  in 2005 in current market conditions. failure to make cutbacks may also push it to reduce its fleet  the group said. shares in the fifth biggest us carrier had fallen 6.87% on the news to $10.44 by 1830 gmt.  without the reduction in wage and benefit costs and a reasonable prospect of future profitability  we believe that our ability to raise additional money through financings would be uncertain   continental said in its filing to the us securities and exchange commission (sec).  airlines have faced tough conditions in recent years  amid terrorism fears since the 11 september world trade centre attack in 2001. but despite passengers returning to the skies  record-high fuel costs and fare wars prompted by competition from low cost carriers have taken their toll. houston-based continental now has debt and pension payments of nearly $984m which it must pay off this year. the company has been working to streamline its operations - and has managed to save $1.1bn in costs without cutting jobs. two weeks  ago the group also announced it would be able to shave a further $48m a year from its costs with changes to wage and benefits for most of its us-based management and clerical staff.,business
1098,ask jeeves joins web log market ask jeeves has bought the bloglines website to improve the way it handles content from web journals or blogs.  the bloglines site has become hugely popular as it gives users one place in which to read  search and share all the blogs they are interested in. ask jeeves said it was not planning to change bloglines but would use the 300 million articles it has archived to round out its index of the web. how much ask jeeves paid for bloglines was not revealed.  bloglines has become popular because it lets users build a list of the blogs they want to follow without having to visit each journal site individually. to do this it makes use of a technology known as really simple syndication (rss) that many blogs have adopted to let other sites know when new entries are made on their journals. the acquisition follows similar moves by other search sites. google acquired pyra labs  makers of the blogger software  in 2003. in 2004 msn introduced its own blog system and yahoo has tweaked its technology to do a better job of handling blog entries. jim lanzone  vice president of search properties at ask jeeves in the us  said it did not acquire bloglines just to get a foothold in the blog publishing world. he said ask jeeves was much more interested in helping people find information they were looking for rather than helping them write it.   the universe of readers is vastly larger than the universe of writers   he said. mr lanzone said the acquisition would sit well with ask s my jeeves service which lets people customise their own web experience and build up a personal collection of useful links.  search engines are about discovering information for the first time and rss is the ideal way to keep track of and monitor those sites   he said. it would also help drive information and entries from blogs to the portals that ask jeeves operates. there would be no instant sweeping changes to bloglines  said mr lanzone.  our intent is to take our time to figure out the right business model not to try to monetise it right away   he said. though mr lanzone added that ask jeeves would be helping organise the database of 300m blog entries bloglines holds with its own net indexing technology.  being able to search the blogosphere as one corpus of information will be very useful in its own right   said mr lanzone. rumours about the acquisition were broken by the napsterization weblog which said it got the hint from ask jeeves insiders.,tech
1128,my memories of marley...  to mark the 60th anniversary of the birth of reggae star bob marley  rob partridge - marley s former head of press at island records - remembers the man behind the legend.  partridge worked with marley from 1977 until the jamaican musician s death in 1981.  :  i joined island records in 1977 and the first week i was there i worked on his show at the rainbow theatre. it was one of the last dates he did in london.   : the album exodus came out in 1977 and that provided five hits and confirmed his global superstar status.  by 1979 he was the biggest touring attraction in the world. i remember going to see dates in milan and turin and they were enormous concerts.   : bob was one of the most mesmeric people i ve ever had the privilege to work with.  he must have had an iron will to succeed. bob was a very driven individual. you realised from the start there was a manifest destiny within him that he believed in. he didn t suffer fools gladly. at the risk of stating the obvious  he was an extraordinary song writer and his stage act was perhaps the greatest i ve ever seen. i saw him many times.   :  i recall in 1978 he came to the uk for top of the pops and a daily mirror journalist did a half-hour interview. it was interrupted to do a rehearsal. he came back into the dressing room to resume the interview but saw a world cup match on tv.   he sat down in front of the tv and after 10 minutes it was obvious he wasn t going to move. that was the end of it. the mirror had a very truncated interview.  the last time i saw him was in london in 1980. i arranged for him to play four days of football indoors in fulham.  bob was a good player. we are talking about jamaican-style football. he was an attacking midfield player. his team assembled wherever his gigs were. we played in brazil against some world cup-winning players.   : it was always a struggle for him to connect with black america. reggae did not correspond with disco in the 70s. but bob in the 1990s became one of the great icons in america and the third world.  in 1991  ten years after his death  he sold more records than at any time during his life.  we saw black america taking bob into their hearts for the first time.   :  bob  in worldwide terms  is the greatest music star there has ever been. if you went to africa he would be recognised everywhere  in places john lennon or elvis wouldn t be.  no disrespect to the other artists but a case can be made for him as the greatest  the best and the most influential artist in popular music.   : well 1981 was to be the year he toured africa with stevie wonder. he had only performed in zimbabwe and guinea before.  of course the 1981 tour never happened  but the whole of africa would have embraced him. we can t speculate but he was at the height of his powers and just 36 years old. i had no sense his career was going to go downhill.   :  bob was endlessly optimistic about the way africa would turn out. he realised that nothing was perfect but he had total belief in the power of mankind.  i m sure if he were alive today he would believe africa would firstly become politically free and secondly be able to defeat the aids epidemic.   :  the final tune of his final album was redemption song - one of the most incredible classics of all time.,entertainment
1736,brown calls for £5.5bn aids fund gordon brown has called on rich nations to fund a £5.5bn ($10bn) plan to fight the aids epidemic and find a vaccine.  on the fourth day of his six-day tour of africa  the uk chancellor predicted a vaccine could be found by 2012 if the world stepped up its funding pledges. doubling the £400m being spent yearly on finding such a vaccine could advance it by three years and save six million lives  mr brown said on thursday. he hopes to use the uk s g8 presidency to push the issue forward.   i believe that the generation that provided the finance to combat  cure and eradicate the world s deadliest disease of today - and today the world s least curable disease - hiv/aids - will rightly earn the title  the great generation    mr brown said in a speech during his african tour. the problems of hiv/aids were inseparable from poverty  he added.  at least $10 billion per annum (£5.5bn) is needed to address the hiv/aids crisis in low and middle income countries.  existing financial commitments on their own will not stop the pandemic.  the uk s proposal for an international finance facility is so important - increasing world aid flows by over $50 billion (£27bn). a doubling of world aid to halve world poverty.  mr brown also said he had agreed with the italian finance minister domenico siniscalco to push forward with plans for the world-wide sharing and co-ordination of research into the disease.  currently the private sector was only spending £60m a year on seeking an inoculation and the market needed boosting  mr brown said. he called on industrialised nations to commit themselves to buying the first 300m vaccines at a cost of $20 each  thereby boosting the market for inoculations. this would be a  large enough inducement to create much stronger interest from both large and small pharmaceutical firms   mr brown added.  more must also be done to finance the treatment and care of those living with hiv/aids and their families  he said. but aid charity actionaid criticised mr brown s preoccupation with finding a vaccine and called on g8 nations to fund hiv/aids treatments. the charity s head of hiv/aids in britain  simon wright said:  while encouraging the pharmaceutical industry to discover an hiv vaccine is important  a failure to provide any funding for hiv treatments condemns a generation of people to death.  hiv is decimating african countries  killing the most productive adults who should be working  caring for children and building the economy. an hiv vaccine is probably at least 10 years away. treatments are needed now.  on wednesday  mr brown visited slums in the kenyan capital nairobi . he will visit an hiv/aids orphanage in tanzania and a women s credit union in mozambique before chairing a meeting of the commission for africa in cape town. the chancellor has already unveiled proposals for a g8 aid package which he has likened to the marshall plan used by the united states to rebuild europe after world war two.,politics
140,rich grab half colombia poor fund half of the money put aside by the colombian government to help the country s poor is benefiting people who do not need it  a study has found.  a total of 24.2 trillion pesos ($10.2bn; £5.5bn) is earmarked for subsidies for the poor  the government department for planning said. but it also found 12.1 trillion pesos was going to the richest part of the population  rather than to those in need. sound distribution of the cash could cut poverty levels to 36% from 53%  the government believes.  resources are more than enough to reduce poverty and there is no need for more tax reforms but a better distribution   deputy planning director jose leibovich said.  colombia has a population of about 44 million and half lives below poverty line. however  some large properties are paying less in tax as they are situated inside poor areas  which benefit from cheaper utilities such as electricity and water  government research found. government expenditure in areas such as pensions  public services  education  property and health should be revised  mr leibovich said. he added that the government is now examining the report  but warned there would be no easy solution to the problem. with a good distribution of such subsidies and economic growth of just 2%  by 2019 poverty could fall as low as 15.3%  he said.,business
1941,iaaf awaits greek pair s response kostas kenteris and katerina thanou are yet to respond to doping charges from the international association of athletics federations (iaaf).  the greek pair were charged after missing a series of routine drugs tests in tel aviv  chicago and athens. they have until midnight on 16 december and an iaaf spokesman said:  we re sure their responses are on their way.  if they do not respond or their explanations are rejected  they will be provisionally banned from competition. they will then face a hearing in front of the greek federation  which will ultimately determine their fate. their former coach christos tzekos has also been charged with distributing banned substances. under iaaf rules  the athletes could receive a maximum one-year suspension. kenteris and thanou already face a criminal trial after being charged with avoiding a drug test on the eve of the athens olympics and then faking a motorcyle crash.  no date for the trial has yet been set and again tzekos is also facing charges. the iaaf issued an official warning to the trio last year after they were discovered training in qatar rather than in crete  where they had said they would be. all athletes must inform their national federations where they are at all times  so they can be available for out-of-competition drugs tests. but kenteris and thanou then went on to skip tests in tel aviv and chicago  when they decided to fly back to greece early. then just before the olympics  the pair dramatically missed another test in athens and withdrew from the games.,sport
2,worldcom boss  left books alone  former worldcom boss bernie ebbers  who is accused of overseeing an $11bn (£5.8bn) fraud  never made accounting decisions  a witness has told jurors.  david myers made the comments under questioning by defence lawyers who have been arguing that mr ebbers was not responsible for worldcom s problems. the phone company collapsed in 2002 and prosecutors claim that losses were hidden to protect the firm s shares. mr myers has already pleaded guilty to fraud and is assisting prosecutors.  on monday  defence lawyer reid weingarten tried to distance his client from the allegations. during cross examination  he asked mr myers if he ever knew mr ebbers  make an accounting decision  .  not that i am aware of   mr myers replied.  did you ever know mr ebbers to make an accounting entry into worldcom books   mr weingarten pressed.  no   replied the witness. mr myers has admitted that he ordered false accounting entries at the request of former worldcom chief financial officer scott sullivan. defence lawyers have been trying to paint mr sullivan  who has admitted fraud and will testify later in the trial  as the mastermind behind worldcom s accounting house of cards.  mr ebbers  team  meanwhile  are looking to portray him as an affable boss  who by his own admission is more pe graduate than economist. whatever his abilities  mr ebbers transformed worldcom from a relative unknown into a $160bn telecoms giant and investor darling of the late 1990s. worldcom s problems mounted  however  as competition increased and the telecoms boom petered out. when the firm finally collapsed  shareholders lost about $180bn and 20 000 workers lost their jobs. mr ebbers  trial is expected to last two months and if found guilty the former ceo faces a substantial jail sentence. he has firmly declared his innocence.,business
1658,ray charles studio becomes museum a museum dedicated to the career of the late legendary singer ray charles is to open in his former recording studio in los angeles.  his longtime publicist jerry digney said the museum would house  archive materials from recordings  to awards  to ephemera  to wardrobe . a tour bus used by charles and his entourage over the years will also be on permanent display. it is hoped the museum will be ready for visitors in late 2007.  mr digney said the recording studio and offices had been used by charles for many years  and was where he recorded much of his last album  genius loves company. it is hoped the museum will also house an education centre. the building had been declared a historic landmark by the city of los angeles just before charles  death in june 2004 at the age of 73. following his death  charles won eight grammy awards  including album of the year for genius loves company  a collection of duets.,entertainment
1811,yukos unit fetches $9bn at auction a little-known russian company has bought the main production unit of oil giant yukos at auction in moscow.  baikal finance group outbid favourite gazprom  the state-controlled gas monopoly  to buy yuganskneftegas. baikal paid 260.75bn roubles ($9.37bn: £4.8bn) for yugansk - nowhere near the $27bn russia says yukos owes in taxes. yukos reacted immediately by repeating its view that the auction was illegal in international and russian law  and said baikal had bought itself trouble.   the company considers that the victor of today s auction has bought itself a serious $9bn headache   said yukos spokesman alexander shadrin. he said the company would continue to make  every lawful move  to protect tens of thousands of shareholders in yukos from  this forcible and illegitimate removal of their property . meanwhile  tim osborne  head of yukos main shareholders  group menatep  said that yukos may have to declare itself bankrupt  and that legal action would be taken  outside russia  against the auction winners. reports from russia say baikal has paid a deposit of nearly $1.7bn from a sberbank (savings bank) account to the russian federal property fund  for yugansk.  the sale came despite a restraining order issued by a us court dealing with the firm s bankruptcy application for chapter 11 protection. yukos has always insisted the auction was state-sponsored theft but russian authorities argued they were imposing the law  trying to recover billions in unpaid taxes. there were originally four registered bidders  and with its close ties to the kremlin  state-backed gas monopoly gazprom had been seen as favourite. but just two companies turned up for the auction  gazprom and the unknown baikal finance group  named after a large freshwater lake in siberia. and  according to tass news agency  gazprom did not make a single bid  leaving the way open for baikal  which paid above the auction start price of 246.75bn roubles.  mystery firm baikal finance group is officially registered in the central russian region of tver  but many analysts believe it may be linked to gazprom. kaha kiknavelidze  analyst at troika dialog  said:  i think a decision that yugansk should end up with gazprom was taken a long time ago. so the main question was how to structure this transaction.   i would not exclude that the structure of the deal has slightly changed and gazprom now has a partner.  i would also not exclude that baikal will decline to pay in 14 days  that are given by law  and gazprom is then recognised as the winner. this would give gazprom an extra 14 days to accumulate the needed funds.  another surprise was that the winner paid a significant premium above the starting price.  however  gazprom has announced it is not linked to baikal in any way. and paul collison  chief analyst at brunswick ubs  said:  i see no plausible explanation for the theory that baikal was representing competing interests.  yugansk will most likely end up with gazprom but could still end up with the government. there is still potential for surprises.  yugansk is at the heart of yukos - pumping close to a million barrels of oil a day. the unit was seized by the government which claims the oil giant owes more than $27bn in taxes and fines. yukos says those tax demands are exorbitant  and had sought refuge in us courts.  the us bankruptcy court s initial order on thursday - to temporarily block the sale - in response to yukos filing for chapter 11 bankruptcy protection  was upheld in a second ruling on saturday. the protection  if recognised by the russian authorities  would have allowed yukos  current management to retain control of the business and block the sale of any company assets. yukos has said the sale amounts to expropriation - punishment for the political ambitions of its founder  mikhail khodorkovsky. mr khodorkovsky is now in jail  on separate fraud charges. but president vladimir putin has described the affair as a crackdown on corruption - and the bbc s sarah rainsford in moscow says most russians believe the destruction of yukos is now inevitable. hours before the auction lawyers for menatep  a group through which mr khodorkovsky and his associates control yukos  said they would take legal action in other countries. menatep lawyers  who were excluded from observing the auction  said they would retaliate by seeking injunctions in foreign courts to impound russian oil and gas exports.,business
1855,hitachi unveils  fastest robot  japanese electronics firm hitachi has unveiled its first humanoid robot  called emiew  to challenge honda s asimo and sony s qrio robots.  hitachi said the 1.3m (4.2ft) emiew was the world s quickest-moving robot yet. two wheel-based emiews  pal and chum  introduced themselves to reporters at a press conference in japan. the robots will be guests at the world expo later this month. sony and honda have both built sophisticated robots to show off developments in electronics. explaining why hitachi s emiew used wheels instead of feet  toshihiko horiuchi  from hitachi s mechanical engineering research laboratory  said:  we aimed to create a robot that could live and co-exist with people.   we want to make the robots useful for people ... if the robots moved slower than people  users would be frustrated.  emiew - excellent mobility and interactive existence as workmate - can move at 3.7m/h. its  wheel feet  resemble the bottom half of a segway scooter. with sensors on the head  waist  and near the wheels  pal and chum demonstrated how they could react to commands.  i want to be able to walk about in places like shinjuku and shibuya [shopping districts] in the future without bumping into people and cars   pal told reporters. hitachi said pal and chum  which have a vocabulary of about 100 words  could be  trained  for practical office and factory use in as little as five to six years.  robotics researchers have long been challenged by developing robots that walk in the gait of a human. at the recent aaas (american association for the advancement of science) annual meeting in washington dc  researchers showed off bipedal designs. the three designs  each built by a different research group  use the same principle to achieve a human-like gait.  sony and honda have both used humanoid robots  which are not commercially available  as a way of showing off computing power and engineering expertise. honda s asimo was  born  five years ago. since then  honda and sony s qrio have tried to trump each other with what the robots can do at various technology events. asimo  has visited the uk  germany  the czech republic  france and ireland as part of a world tour. sony s qrio has been singing  jogging and dancing in formation around the world too and was  until last year  the fastest robot on two legs. but its record was beaten by asimo. it is capable of 3km/h  which its makers claim is almost four times as fast as qrio. last year  car maker toyota also stepped into the ring and unveiled its trumpet-playing humanoid robot. by 2007  it is predicted that there will be almost 2.5 million  entertainment and leisure  robots in homes  compared to about 137 000 currently  according to the united nations (un). by the end of that year  4.1 million robots will be doing jobs in homes  said the report by the un economic commission for europe and the international federation of robotics. hitachi is one of the companies with home cleaning robot machines on the market.,tech
