ArticleId,Text,Category
445,peugeot deal boosts mitsubishi struggling japanese car maker mitsubishi motors has struck a deal to supply french car maker peugeot with 30 000 sports utility vehicles (suv).  the two firms signed a memorandum of understanding  and say they expect to seal a final agreement by spring 2005. the alliance comes as a badly-needed boost for loss-making mitsubishi  after several profit warnings and poor sales. the suvs will be built in japan using peugeot s diesel engines and sold mainly in the european market. falling sales have left mitsubishi motors with underused capacity  and the production deal with peugeot gives it a chance to utilise some of it.  in january  mitsubishi motors issued its third profits warning in nine months  and cut its sales forecasts for the year to march 2005. its sales have slid 41% in the past year  catalysed by the revelation that the company had systematically been hiding records of faults and then secretly repairing vehicles. as a result  the japanese car maker has sought a series of financial bailouts. last month it said it was looking for a further 540bn yen ($5.2bn; £2.77bn) in fresh financial backing  half of it from other companies in the mitsubishi group. us-german carmaker daimlerchrylser  a 30% shareholder in mitsubishi motors  decided in april 2004 not to pump in any more money. the deal with peugeot was celebrated by mitsubishi s newly-appointed chief executive takashi nishioka  who took over after three top bosses stood down last month to shoulder responsibility for the firm s troubles. mitsubishi motors has forecast a net loss of 472bn yen in its current financial year to march 2005. last month  it signed a production agreement with japanese rival nissan motor to supply it with 36 000 small cars for sale in japan. it has been making cars for nissan since 2003.,business
105,howard pitches for uk ethnic vote michael howard is to make a pitch for britain s ethnic vote urging people who feel  taken for granted  by tony blair to vote conservative.  he will say conservatives  share the same values  as the uk s minorities. and that he wants to build a  better britain  where everyone  whatever the colour of their skin or religion  can  make the most of their talents . but the tory leader will argue against positive discrimination saying it is  outdated and unjust .   it sets family against family and it leads ethnic communities to doubt their own abilities   he will argue. mr howard - himself the son of immigrants - will acknowledge that racial discrimination still exists in the uk.  people from ethnic communities  for example  still earn less than their white counterparts   he will say before arguing the answer to helping everyone to get on was  free enterprise  free trade  free speech . the tory leader will also call for religious tolerance arguing that hindus and sikhs as well as muslims got  caught in the downdraft of islamaphobia which was one of the terrible side effects of 9/11 .  mr howard will make his speech during a visit to support tory parliamentary hopefuls robert light and sayeeda warsi -  the first british muslim woman  selected to run for mp as a conservative candidate. he will attack labour s record in government over issues such as tax and he will set out tory plans for an immigration quota to be set by mps. mr howard will also attack the lib dems for wanting to abolish faith schools  introduce compulsory sex education from the age of seven  and  give contraceptives out in schools from the age of 11 .  so i say to all those people from ethnic minorities who feel mr blair and the liberal democrats take their votes for granted - come join us   he will say. lib dem president simon hughes branded mr howard  arrogant and wrong  for claiming the tories were the  natural party  for britain s ethnic minorities.  given the tories  considerably reduced support in urban areas  where many black and asian britons live  during their time in power  the evidence simply does not support his claims that the conservatives are the party for these communities   he said.,politics
1297,clarke to press on with id cards new home secretary charles clarke has vowed to plough on with plans for id cards despite a call for him to  pause for thought  from charles kennedy.  the lib dem leader said david blunkett s resignation was a  good opportunity  to question whether the legislation was necessary. but mr clarke said he had supported the plans when mr blunkett argued for them in cabinet and he supported them now.  id cards are a means to creating a more secure society   he said. mr clarke acknowledged how the measure was introduced remained a matter for debate but he said legislation had already been  significantly influenced  by the recommendations of the commons  home affairs committee.  the issue would be debated in parliament next monday as scheduled he insisted. earlier mr kennedy  whose party opposes the id cards plan as  deeply flawed  said with christmas coming up the new home secretary had time to think again. he told bbc radio 4 s today programme that mr clarke had been reported to be less enthusiastic about id cards than his predecessors.  wouldn t this be a good opportunity for a new home secretary  a new broom  to sweep clean in this respect and why do we need this legislation in the first place   he asked. earlier this week the tories announced they would back the government s plans although michael howard was forced to deny the shadow cabinet was split over its decision.  they had decided to support the plans as the police said they would help fight terror  crime and illegal immigration. among those reported to have serious reservations over the strategy were senior shadow cabinet members david davis  oliver letwin and tim yeo. the chairman of the bar council  guy mansfield qc has warned there is a real risk that people on the  margins of society  would be driven into the hands of extremists.  what is going to happen to young asian men when there has been a bomb gone off somewhere  they are going to be stopped. if they haven t [id cards] they are going to be detained.   the home office says people will pay £85 for a passport and id card together or a undecided fee for a separate id card. the first cards would be issued in 2008 and when he was introducing the bill  mr blunkett suggested parliament could decide in 2011 or 2012 whether to make it compulsory for everybody to own the cards  although not to carry them. the new bill will also create new criminal offences on the possession of false identity documents. and there will be civil penalties including a fine of up to £1 000 fine for people who fail to say they have moved house or changed other details and of up to £2 500 for failing to sign up if the cards become compulsory. the scheme will be overseen by a new independent watchdog.,politics
1932,venus stunned by farina elia venus williams suffered a first-round defeat for the first time in four years at the dubai championships.  sylvia farina elia  who had lost all nine of her previous meetings with the american fifth seed  won 7-5 7-6 (8-6). former wimbledon champion conchita martinez and india s sania mirza  the oldest and youngest players in the draw  also reached the second round. martinez  32  beat shinobu asagoe 6-4 6-4 and 18-year-old mirza beat jelena kostanic 6-7 (7-2) 6-4 6-1. mirza  the first indian woman to win a wta tour title this month on home ground at hyderabad  will now face us open champion svetlana kuznetsova.  but she is remaining confident.  she (kuznetsova) is a great player   she said.  but everyone is beatable and i am looking forward to a great match.  williams though blamed her defeat by farina elia on injuries.  blisters were a factor  but mostly my stomach wasn t that great   she said.  i did it in the last tournament in the semi-finals  and i was serving at 40% in the final.  the first time i served again was sunday and there wasn t a lot i could do out there. when your serve isn t good it throws the rest of your game off too.  she will wait to see how she recovers before deciding whether to take part in the nasdaq-100 open in miami  starting on 21 march.,sport
1458,iranian misses israel match iranian striker vahid hashemian will not travel to israel for bayern munich s champions league match against maccabi tel aviv on wednesday.  the german club said the player had pulled out because of a back injury. iran refuses to recognise israel s right to exist and does not allow its citizens to travel to the country. a bayern spokesman said on monday that the decision not to take hashemian to israel had been motivated only by his physical condition.  he s got back pain and he couldn t train   the spokesman said.  it would have made no sense for him to go.  iran gave judo world champion arash miresmaeili a $125 000 reward when he refused to fight an israeli at the athens olympics. the international judo federation considered taking action against miresmaeili but concluded he had been overweight for the fight and could not have taken part.,sport
2127,boris opposes mayor apology ken livingstone should  stick to his guns  and not apologise for his  nazi  comment to a jewish reporter  tory mp boris johnson has insisted.  mr johnson also claimed tony blair s intervention in the row was  an attempt to reassure jewish voters . london mayor mr livingstone says he is  standing by  his remarks which likened an evening standard journalist to a  concentration camp guard . but the prime minister says it is time for mr livingstone to say sorry.  labour s mr livingstone has said his comments may have been offensive but were not racist  and said earlier this week he would not apologise even if mr blair asked. later the prime minister said:  a lot of us in politics get angry with journalists from time to time  but in the circumstances  and to the journalist because he was a jewish journalist  yes  he should apologise.   however  mr johnson  who was forced to apologise last year for an article in the magazine he edits about liverpudlians grieving over the death of british hostage ken bigley  said mr blair  should butt out of  the row.  i don t see why the prime minister has to get involved in this   the spectator editor told bbc radio 4 s today programme.  it s a dispute between ken livingstone and a reporter on the evening standard.  mr johnson  mp for henley-on-thames  oxfordshire  said he suspected labour was now trying to reassure jewish voters  because of this curious way in which labour seems to be trying to curry favour with disillusioned muslim voters who may be disillusioned about the war .   ken doesn t think he s got anything to say sorry for and if that s really his feeling  then i think that he should stick to his guns   he said. mr johnson apologised last october for perpetuating an  outdated stereotype  of liverpool in the leader article on the death of mr bigley. the article in the magazine suggested grieving liverpudlians were wallowing in their victim status. it also attributed blame to drunken liverpool football fans for the 1989 hillsborough disaster in which 96 died. mr johnson told today:  it s perfectly true that i got into the grovelling game myself and when i apologised there were some things that i felt i ought to say sorry for ... there were also other things i didn t think i should apologise for   he said.  but here s old ken - he s been crass  he s been insensitive and thuggish and brutal in his language - but i don t think actually if you read what he said  although it was extraordinary and rude  i don t think he was actually anti-semitic.,politics
1321,deal to ban  homophobic  reggae the reggae industry is to refuse to release or stage concerts featuring homophobic songs under a global deal struck with gay rights groups.  a damaging campaign against stars such as beenie man and sizzla has been waged over lyrics that allegedly call for gay people to be killed or assaulted. the campaign  which led to gigs being scrapped and a uk police investigation  will now be dropped under the truce. brett lock of gay group outrage! said they were  wiping the slate clean . the protests had been led by the stop murder music coalition  an umbrella group including outrage!  the black gay men s advisory group and jamaican movement j-flag.  that coalition has reached a verbal agreement with major dancehall reggae record labels and concert promoters covering eight of the scene s biggest stars. but the artists themselves were not involved in the negotiations and have not directly signed up. instead  the record companies have pledged not to release or re-release any offensive songs - many of which date back a number of years. and it is believed promoters will make stars agree not to perform such tunes on stage.  the reggae industry will work with the artists while still maintaining their freedom of speech and artistic freedom   according to media and pr strategist glen yearwood  who is representing the reggae industry.  the industry would halt any attempt by an artist to perform or release a song inciting violence against any group or gender  he said.  we ll advise them this is not the way forward in a civilised society.  the stop murder music campaign saw protesters picket gigs  resulted in sizzla s uk tour being cancelled in november  forced mobo award organisers to drop artists from nominations and saw beenie man dropped from an mtv show in august. police have also been investigating whether lyrics incite the assault and murder of gay people. the campaign was a blow to the reggae industry  mr yearwood admitted.  if you can t have major stars touring  then you don t sell many albums   he said.  but the artists - beenie man  sizzla  elephant man  buju banton  bounty killer  tok  capleton and vybz kartel - will not have to apologise for past songs or comments. outrage! s mr lock said:  the main players in the dancehall reggae industry will attempt to regulate the industry themselves to ensure that there aren t any violently homophobic or gay-bashing lyrics in the future.  as a gesture of good faith  the stop murder music coalition has agreed to suspend our aggressive campaigning against murder music.  so we shall not be picketing concerts or calling for prosecutions to give the industry the space to regulate and reform itself.  record companies vp and greensleeves  distributor jet star and concert promoters including jammins and apollo entertainment are all on board.,entertainment
699,britain boosted by holmes double athletics fans endured a year of mixed emotions in 2004 as stunning victories went hand-in-hand with disappointing defeats and more drugs scandals.  kelly holmes finally fulfilled her potential by storming to double gold on the track at the olympic games. holmes helped erase the gloom hanging over team gb after their biggest medal hope  paula radcliffe  dropped out of the marathon and then the 10 000m. britain s men s 4x100m relay team also did their bit by taking a shock gold. holmes had started the year in disappointing style  falling over in the final of 1500m at the world indoor championships where she was favourite. her olympic build-up was clouded by self doubt but that proved unfounded as she overhauled rival maria mutola to win the 800m - her first global title. just five days later  the 34-year-old made it double gold in the 1500m. it was the first time in 84 years a briton has achieved the olympic middle-distance double. while holmes left athens as the star of team gb  it was radcliffe who carried expectations before the august games.  the 30-year-old marathon world record holder went into the athens event as favourite but an exhausted radcliffe dropped out after 23 miles in tears. her decision to enter the 10 000m five days later also backfired as she again pulled out with eight laps remaining.  but radcliffe helped put her olympic trauma behind her with a thrilling win in november s new york marathon. the 4x100m team grabbed some last-gasp glory for the british men s olympic squad after a poor start to the games.  it seemed as though athens would be the first games where the men would fail to win a medal with michael east the only individual track finalist in the 1500m. but darren campell  jason gardener  marlon devonish and mark lewis-francis made amends in the sprint relay. the quartet held off favourites the usa to win britain s first relay medal since 1912 in 38.07 seconds. gardener added the olympic relay crown to his world indoor title over 60m and  just like holmes  finally lived up to his promise in 2004. kelly sotherton completed team gb s athletics medal haul in athens with a surprise bronze in the heptathlon. the 28-year-old won her first championship medal since becoming a full-time athlete in 2003.  but it was a different story for britain s defending champion denise lewis  who withdrew on day two of the competition after some poor results. lewis  who was troubled by injury  has ruled out retiring while sotherton is tipped to build on her success. the athens olympics proved to be a landmark occasion for steve backley  who retired from competition after finishing fourth in the javelin. the battling 35-year-old leaves the sport with a vast medal haul including two silvers and one olympic bronze.  and backley s departure was balanced by the return of injury-hit decathlete dean macey  who came fourth in athens.  the continued improvement of sprinter abi oyepitan and long jumper chris tomlinson also boosted team gb. sadly  the 2004 olympics did not escape the problems of drugs misuse. on the eve of the games  greek sprinters kostas kenteris and katerina thanou missed a drugs test and claimed to have been involved in a road crash.  kenteris  the 200m champion in 2000  and thanou have since been charged by the greek authorities and await trial. at the games  adrian annus (hammer)  robert fazelas (discus) and irina korzhanenko (shot) were all stripped of their titles because of doping issues. hungarian compatriots annus and fazelas both refused to give urine samples while russian korzhanenko tested positive for the steroid stanozolol.  the fallout from the thg scandal  which rocked the sport in 2003  continued to impact in olympic year. britain s 4x100m team took gold without the services of dwain chambers  who was handed a two-year ban in february after testing positive for steroid thg.  american kelli white was suspended and stripped of her world 100m and 200m titles after failing a drugs test. and world 400m champion jerome young landed a life ban from us chiefs after a second doping offence. russian pole vaulter yelena isinbayeva provided some light relief by smashing the world record seven times on her way to the world indoor and olympic titles. her rivalry with compatriot svetlana feofanova livened up the field events. morocco s hicham el guerrouj also delighted fans by racing to a historic olympic double in the 1500m and 5 000m.  and though there was no paula radcliffe in the london marathon  there was plenty of drama as kenyans evans rutto and margaret okayo took the titles. rutto held on to win despite slipping on some cobblestones and tumbling into a barrier. okayo also had to battle back after mistiming her tactics but clinched victory on her debut.,sport
1738,campbell to be lions consultant former government communications chief alastair campbell will act as a media consultant to sir clive woodward s 2005 lions on their tour to new zealand.  campbell  who left downing street earlier this year  will advise on media strategy before and during the tour.  i hope i can contribute to the planning and preparation  and to ensuring the media and public get the most out of the tour itself   he said.  i am also looking forward to going out for the later stages of the tour.  woodward s decision to call in prime minister tony blair s former spin doctor springs from the deterioration in media relations on the last lions tour of australia in 2001  when new zealander graham henry was the head coach. the furore surrounding the newspaper diaries of matt dawson and austin healey was compounded by other disillusioned players venting their frustration through the media.  the lions is a massive media event   said woodward  who will be the head coach.  there will be a huge level of interest from the travelling media  the fans that will go out in their thousands and the new zealand public.  we need to have the strategy and processes in place to deal with the pressures that will bring.  [alastair] will act as an advisor both in the build up to and on the tour itself. his role is to work closely with not only myself but (tour manager) bill beaumont  (media manager) louisa cheetham and (team manager) louise ramsay.  campbell is due to resume working for the government in the new year in the build-up to an anticipated may general election. the lions leave for new zealand on 24 may  with the first test match against the all blacks in christchurch on 25 june.,sport
639,could rivalry overshadow election  tony blair and gordon brown are desperately trying to stuff the genie of their rivalry back into the bottle.  along with any number of senior cabinet colleagues  they are insisting their only job is to win the next election and govern in the best interests of britain. it is a message they are aiming directly at their backbenchers who are becoming irritated and even unnerved by the continuing claims and counter claims surrounding this alleged rift. ian gibson  for example  urged the two men to stop squabbling  declaring:  for goodness sake  sometimes you have to rise above petulance and make sure that you do your job as effectively as you can.  those with slim majorities are particularly fearful that the rift could hit their own hopes of re-election. tony blair will seek to reassure labour mps on monday evening at their first meeting of the new year at westminster - a behind-closed doors meeting which gordon brown is thought likely to also attend to show unity.  meanwhile the likes of health secretary john reid and labour peer lord haskins are warning of the electoral dangers of allowing this soap opera to continue. and they have both warned the rival camps to stop spreading the poison. lord haskins even suggested mr blair should reinstate mr brown as the central figure in the election planning.  but this particular genie is unusually reluctant to return to captivity and many fear it is simply too late to repair the damage. they believe they will be fighting the next election with the sounds of open warfare between the two men ringing in their ears. and it matters little whether the rift is real or  as some try to suggest  simply the product of newspaper headlines and westminster gossip. few in westminster actually believe that  simply because the evidence appears to contradict it.  for example  the weekend s attempts by both men to play down the divisions failed to do the trick. even as they were both insisting on their unity of purpose and claiming they would not be swayed by newspaper stories  they still managed to stir the speculation with their comments.  mr blair talked about the  new  labour manifesto - a move which seemed calculated to irritate the chancellor  who has long rejected the label. and mr brown pointedly refused to deny claims the prime minister had reneged on a deal to hand him the premiership last year. that claim was repeated in robert peston s book  a book which amply demonstrates this corrosive downing street soap opera is nowhere near its final act.  for his part  mr brown insists his only motivation was to get labour re-elected.  the trouble is  both men have fallen short of offering simple  straightforward denials of the central claims. so they have both been accused of actually making matters worse by feeding the speculation with their own behaviour. the first thing to be said is that these suggestions have not come from nowhere. they started with and are sustained by  friends  of the two men. one only had to listen to the chancellor s friend and former spin chief charlie whelan last week to understand that there is a real anger from this camp at the prime minister s apparent attempts to confound mr brown s leadership ambitions. but it is not just public pronouncements from ex-aides.  there are whispered briefings to selected journalists from both sides. it is no secret in westminster  for example  that downing street believes the chancellor is indulging in a mammoth sulk and acting in a petty and deliberately provocative manner.  then there are the actions of the men themselves. gordon brown sets out what is seen as a rival manifesto then appears to embark on his own personal campaign. the prime minister responds by scheduling his monthly press conference to clash with a keynote speech by the chancellor. meanwhile large numbers of backbench mps insist voters are either entirely uninterested in the chatter  which they believe is a media-only obsession  or that they fear for the efficient running of a government beset by such rivalry. either way  there is universal agreement that if this goes on through the general election it can only do the labour party serious damage. there are signs that the two men appreciate the dangers and both want to put a lid on all the speculation. but with probably only four months to the next election  that looks like being a particularly difficult trick to pull off.,politics
